<?xml version="1.0" encoding="UTF-8"?>
<!--
This file is protected by Copyright. Please refer to the COPYRIGHT file
distributed with this source distribution.

This file is part of REDHAWK core.

REDHAWK core is free software: you can redistribute it and/or modify it under
the terms of the GNU Lesser General Public License as published by the Free
Software Foundation, either version 3 of the License, or (at your option) any
later version.

REDHAWK core is distributed in the hope that it will be useful, but WITHOUT ANY
WARRANTY; without even the implied warranty of MERCHANTABILITY or FITNESS FOR
A PARTICULAR PURPOSE.  See the GNU Lesser General Public License for more
details.

You should have received a copy of the GNU Lesser General Public License along
with this program.  If not, see http://www.gnu.org/licenses/.
-->
<!DOCTYPE properties PUBLIC "-//JTRS//DTD SCA V2.2.2 PRF//EN" "properties.dtd">
<properties>
  <simple id="my_simple" mode="readwrite" type="string">
    <kind kindtype="configure"/>
    <action type="external"/>
  </simple>
  <simplesequence id="my_seq" mode="readwrite" type="string">
    <kind kindtype="configure"/>
    <action type="external"/>
  </simplesequence>
  <struct id="basic_struct" mode="readwrite">
    <simple id="some_simple" type="string"/>
    <configurationkind kindtype="configure"/>
  </struct>
</properties>
