<?xml version="1.0" encoding="UTF-8"?>
<!--
This file is protected by Copyright. Please refer to the COPYRIGHT file
distributed with this source distribution.

This file is part of REDHAWK core.

REDHAWK core is free software: you can redistribute it and/or modify it under
the terms of the GNU Lesser General Public License as published by the Free
Software Foundation, either version 3 of the License, or (at your option) any
later version.

REDHAWK core is distributed in the hope that it will be useful, but WITHOUT ANY
WARRANTY; without even the implied warranty of MERCHANTABILITY or FITNESS FOR
A PARTICULAR PURPOSE.  See the GNU Lesser General Public License for more
details.

You should have received a copy of the GNU Lesser General Public License along
with this program.  If not, see http://www.gnu.org/licenses/.
-->
<!DOCTYPE properties PUBLIC "-//JTRS//DTD SCA V2.2.2 PRF//EN" "properties.dtd">
<properties>
  <simple id="DCE:cdc5ee18-7ceb-4ae6-bf4c-31f983179b4d" mode="readonly" name="device_kind" type="string">
    <description>This specifies the device kind</description>
    <value>start_event_device</value>
    <kind kindtype="allocation"/>
    <action type="eq"/>
  </simple>
  <simple id="DCE:0f99b2e4-9903-4631-9846-ff349d18ecfb" mode="readonly" name="device_model" type="string">
    <description> This specifies the specific device</description>
    <kind kindtype="allocation"/>
    <action type="eq"/>
  </simple>
  <struct id="state_change" mode="readwrite">
    <simple id="state_change::identifier" name="identifier" type="string"/>
    <simple id="state_change::event" name="event" type="string"/>
    <configurationkind kindtype="message"/>
  </struct>
  <struct id="failures" mode="readwrite">
    <simple id="failures::start" name="start" type="boolean">
      <value>false</value>
    </simple>
    <simple id="failures::stop" name="stop" type="boolean">
      <value>false</value>
    </simple>
    <configurationkind kindtype="property"/>
  </struct>
</properties>
