<?xml version="1.0" encoding="UTF-8"?>
<!--
This file is protected by Copyright. Please refer to the COPYRIGHT file 
distributed with this source distribution.

This file is part of REDHAWK core.

REDHAWK core is free software: you can redistribute it and/or modify it under 
the terms of the GNU Lesser General Public License as published by the Free 
Software Foundation, either version 3 of the License, or (at your option) any 
later version.

REDHAWK core is distributed in the hope that it will be useful, but WITHOUT ANY 
WARRANTY; without even the implied warranty of MERCHANTABILITY or FITNESS FOR 
A PARTICULAR PURPOSE.  See the GNU Lesser General Public License for more 
details.

You should have received a copy of the GNU Lesser General Public License along 
with this program.  If not, see http://www.gnu.org/licenses/.
-->

<!DOCTYPE properties PUBLIC '-//JTRS//DTD SCA V2.2.2 PRF//EN' 'properties.dtd'>
<properties>
    <simple id="DCE:6b298d70-6735-43f2-944d-06f754cd4eb9" name="no_default_prop" mode="readwrite" type="string">
        <description>A configure property with no default value.</description>
        <kind kindtype="configure"/>
    </simple>
    <simple id="DCE:456310b2-7d2f-40f5-bfef-9fdf4f3560ea" name="default_prop" mode="readwrite" type="string">
        <description>A configure property with a default value.</description>
        <value>default</value>
        <kind kindtype="configure"/>
    </simple>
    <simple id="number_connections" name="number_connections" mode="readwrite" type="short">
        <description>number of connections that the component has</description>
        <value>0</value>
        <kind kindtype="configure"/>
    </simple>
    <!-- Provide a variety of matching allocation properties. -->
    <simple id="DCE:7f36cdfb-f828-4e4f-b84f-446e17f1a85b"
            name="DeviceKind"
            mode="readonly"
            type="string"
            >
        <description>
            The type of this device...see D.4.1.17
        </description>
        <value>BasicUsesDevice</value>
        <kind kindtype="allocation"/>
        <action type="eq"/>
    </simple>
    <simple id="DCE:64303822-4c67-4c04-9a5c-bf670f27cf39"
            name="RunsAs"
            mode="readonly"
            type="string"
            >
        <value>root</value>
        <kind kindtype="allocation"/>
        <action type="ne"/>
    </simple>
    <!-- Provide two external capacities that can be allocated -->
    <simple id="DCE:8cad8ca5-c155-4d1d-ae40-e194aa1d855f"
            name="bandwidthCapacity"
            mode="readonly"
            type="long">
        <description>
            Amount of bandwidth available in the NIC
        </description>
	<units>bps</units>
        <kind kindtype="allocation"/>
    </simple>
</properties>
