<?xml version="1.0" encoding="UTF-8"?>
<!DOCTYPE properties PUBLIC "-//JTRS//DTD SCA V2.2.2 PRF//EN" "properties.dtd">
<properties>
  <simple id="get_rfinfo" mode="readonly" type="string">
    <kind kindtype="property"/>
    <action type="external"/>
  </simple>
  <simple id="set_rfinfo" mode="readonly" type="string">
    <kind kindtype="property"/>
    <action type="external"/>
  </simple>
  <simple id="get_available_rf" mode="readonly" type="string">
    <kind kindtype="property"/>
    <action type="external"/>
  </simple>
  <simple id="set_available_rf" mode="readonly" type="string">
    <kind kindtype="property"/>
    <action type="external"/>
  </simple>
  <simple id="get_current_rf" mode="readonly" type="string">
    <kind kindtype="property"/>
    <action type="external"/>
  </simple>
  <simple id="set_current_rf" mode="readonly" type="string">
    <kind kindtype="property"/>
    <action type="external"/>
  </simple>
  <simple id="bad_connection" mode="readonly" type="string">
    <kind kindtype="property"/>
    <action type="external"/>
  </simple>
  <simple id="get_tunertype" mode="readonly" type="string">
    <kind kindtype="property"/>
    <action type="external"/>
  </simple>
  <simple id="get_tunerdevicecontrol" mode="readonly" type="string">
    <kind kindtype="property"/>
    <action type="external"/>
  </simple>
  <simple id="get_tunergroupid" mode="readwrite" type="string">
    <kind kindtype="property"/>
    <action type="external"/>
  </simple>
  <simple id="get_tunerrfflowid" mode="readwrite" type="string">
    <kind kindtype="property"/>
    <action type="external"/>
  </simple>
  <simple id="get_tunerstatus" mode="readwrite" type="string">
    <kind kindtype="property"/>
    <action type="external"/>
  </simple>
  <simple id="set_tunercenterfrequency" mode="readwrite" type="string">
    <kind kindtype="property"/>
    <action type="external"/>
  </simple>
  <simple id="get_tunercenterfrequency" mode="readwrite" type="string">
    <kind kindtype="property"/>
    <action type="external"/>
  </simple>
  <simple id="set_tunerbandwidth" mode="readwrite" type="string">
    <kind kindtype="property"/>
    <action type="external"/>
  </simple>
  <simple id="get_tunerbandwidth" mode="readwrite" type="string">
    <kind kindtype="property"/>
    <action type="external"/>
  </simple>
  <simple id="set_tuneragcenable" mode="readwrite" type="string">
    <kind kindtype="property"/>
    <action type="external"/>
  </simple>
  <simple id="get_tuneragcenable" mode="readwrite" type="string">
    <kind kindtype="property"/>
    <action type="external"/>
  </simple>
  <simple id="set_tunergain" mode="readwrite" type="string">
    <kind kindtype="property"/>
    <action type="external"/>
  </simple>
  <simple id="get_tunergain" mode="readwrite" type="string">
    <kind kindtype="property"/>
    <action type="external"/>
  </simple>
  <simple id="set_tunerreferencesource" mode="readwrite" type="string">
    <kind kindtype="property"/>
    <action type="external"/>
  </simple>
  <simple id="get_tunerreferencesource" mode="readwrite" type="string">
    <kind kindtype="property"/>
    <action type="external"/>
  </simple>
  <simple id="set_tunerenable" mode="readwrite" type="string">
    <kind kindtype="property"/>
    <action type="external"/>
  </simple>
  <simple id="get_tunerenable" mode="readwrite" type="string">
    <kind kindtype="property"/>
    <action type="external"/>
  </simple>
  <simple id="set_tuneroutputsamplerate" mode="readwrite" type="string">
    <kind kindtype="property"/>
    <action type="external"/>
  </simple>
  <simple id="get_tuneroutputsamplerate" mode="readwrite" type="string">
    <kind kindtype="property"/>
    <action type="external"/>
  </simple>
  <simple id="get_gpsinfo" mode="readwrite" type="string">
    <kind kindtype="property"/>
    <action type="external"/>
  </simple>
  <simple id="set_gpsinfo" mode="readwrite" type="string">
    <kind kindtype="property"/>
    <action type="external"/>
  </simple>
  <simple id="get_gps_timepos" mode="readwrite" type="string">
    <kind kindtype="property"/>
    <action type="external"/>
  </simple>
  <simple id="set_gps_timepos" mode="readwrite" type="string">
    <kind kindtype="property"/>
    <action type="external"/>
  </simple>
  <simple id="get_nav_packet" mode="readwrite" type="string">
    <kind kindtype="property"/>
    <action type="external"/>
  </simple>
  <simple id="set_nav_packet" mode="readwrite" type="string">
    <kind kindtype="property"/>
    <action type="external"/>
  </simple>
</properties>
