<?xml version="1.0" encoding="UTF-8"?>
<!--
This file is protected by Copyright. Please refer to the COPYRIGHT file
distributed with this source distribution.

This file is part of REDHAWK throughput.

REDHAWK throughput is free software: you can redistribute it and/or modify it under
the terms of the GNU Lesser General Public License as published by the Free
Software Foundation, either version 3 of the License, or (at your option) any
later version.

REDHAWK throughput is distributed in the hope that it will be useful, but WITHOUT ANY
WARRANTY; without even the implied warranty of MERCHANTABILITY or FITNESS FOR
A PARTICULAR PURPOSE.  See the GNU Lesser General Public License for more
details.

You should have received a copy of the GNU Lesser General Public License along
with this program.  If not, see http://www.gnu.org/licenses/.
-->
<!DOCTYPE properties PUBLIC "-//JTRS//DTD SCA V2.2.2 PRF//EN" "properties.dtd">
<properties>
  <simple id="transfer_length" mode="readwrite" type="ulong">
    <value>1024</value>
    <kind kindtype="property"/>
    <action type="external"/>
  </simple>
  <simple id="total_packets" mode="readonly" type="ulong">
    <value>0</value>
    <kind kindtype="property"/>
    <action type="external"/>
  </simple>
  <simple id="average_time" mode="readonly" type="double">
    <value>0.0</value>
    <kind kindtype="property"/>
    <action type="external"/>
  </simple>
</properties>
