<?xml version="1.0" encoding="UTF-8"?>
<!DOCTYPE properties PUBLIC "-//JTRS//DTD SCA V2.2.2 PRF//EN" "properties.dtd">
<properties>
  <simple id="DCE:cdc5ee18-7ceb-4ae6-bf4c-31f983179b4d" mode="readonly" name="device_kind" type="string">
    <description>This specifies the device kind</description>
    <kind kindtype="allocation"/>
    <action type="eq"/>
  </simple>
  <simple id="DCE:0f99b2e4-9903-4631-9846-ff349d18ecfb" mode="readonly" name="device_model" type="string">
    <description> This specifies the specific device</description>
    <kind kindtype="allocation"/>
    <action type="eq"/>
  </simple>
  <struct id="s_prop" mode="readwrite">
    <simple id="s_prop::a" type="string"/>
    <simple id="s_prop::b" type="short"/>
    <simplesequence id="abc" type="double"/>
    <configurationkind kindtype="allocation"/>
  </struct>
  <simplesequence id="se_prop" mode="readwrite" type="float">
    <kind kindtype="allocation"/>
    <action type="external"/>
  </simplesequence>
  <simple id="si_prop" mode="readwrite" type="short">
    <kind kindtype="allocation"/>
    <action type="external"/>
  </simple>
  <structsequence id="sq_prop" mode="readwrite">
    <struct id="sq_prop_s">
      <simple id="sq_prop::a" type="float"/>
      <simple id="sq_prop::b" type="string"/>
    </struct>
    <configurationkind kindtype="allocation"/>
  </structsequence>
</properties>
