<?xml version="1.0" encoding="UTF-8"?>
<!--
This file is protected by Copyright. Please refer to the COPYRIGHT file 
distributed with this source distribution.

This file is part of REDHAWK core.

REDHAWK core is free software: you can redistribute it and/or modify it under 
the terms of the GNU Lesser General Public License as published by the Free 
Software Foundation, either version 3 of the License, or (at your option) any 
later version.

REDHAWK core is distributed in the hope that it will be useful, but WITHOUT ANY 
WARRANTY; without even the implied warranty of MERCHANTABILITY or FITNESS FOR 
A PARTICULAR PURPOSE.  See the GNU Lesser General Public License for more 
details.

You should have received a copy of the GNU Lesser General Public License along 
with this program.  If not, see http://www.gnu.org/licenses/.
-->
<!DOCTYPE properties PUBLIC "-//JTRS//DTD SCA V2.2.2 PRF//EN" "properties.dtd">
<properties>
  <simple id="DCE:cdc5ee18-7ceb-4ae6-bf4c-31f983179b4d" mode="readonly" name="device_kind" type="string">
    <description>This specifies the device kind</description>
    <value>GPP</value>
    <kind kindtype="allocation"/>
    <action type="eq"/>
  </simple>
  <simple id="DCE:0f99b2e4-9903-4631-9846-ff349d18ecfb" mode="readonly" name="device_model" type="string">
    <description> This specifies the specific device</description>
    <value>NicExecDevice</value>
    <kind kindtype="allocation"/>
    <action type="eq"/>
  </simple>
  <simple id="DCE:9B445600-6C7F-11d4-A226-0050DA314CD6" mode="readonly" name="processor_name" type="string">
    <description>SCA required property describing the CPU type</description>
    <value>x86_64</value>
    <kind kindtype="allocation"/>
    <action type="eq"/>
  </simple>
  <simple id="DCE:80BF17F0-6C7F-11d4-A226-0050DA314CD6" mode="readonly" name="os_name" type="string">
    <description>SCA required property describing the Operating System Name</description>
    <value>Linux</value>
    <kind kindtype="allocation"/>
    <action type="eq"/>
  </simple>
  <simple id="DCE:0f3a9a37-a342-43d8-9b7f-78dc6da74192" mode="readonly" name="os_version" type="string">
    <description>SCA required property describing the Operating System Version</description>
    <kind kindtype="allocation"/>
    <action type="eq"/>
  </simple>
  <simplesequence id="nic_list" mode="readonly" type="string">
    <kind kindtype="property"/>
    <action type="external"/>
  </simplesequence>
  <struct id="nic_allocation" mode="readwrite">
    <simple id="nic_allocation::identifier" name="identifier" type="string">
      <description>Uniquely identifies the allocation.  Used for updates and deallocations.

Required

</description>
      <value></value>
    </simple>
    <simple id="nic_allocation::interface" name="interface" type="string">
      <description>Requires this specific interface.

Optional</description>
      <value></value>
    </simple>
    <configurationkind kindtype="allocation"/>
  </struct>
  <structsequence id="nic_allocation_status" mode="readonly">
    <struct id="nic_allocation_status_struct">
      <simple id="nic_allocation_status::identifier" name="identifier" type="string">
        <description>Uniquely identifies the allocation. </description>
      </simple>
      <simple id="nic_allocation_status::interface" name="interface" type="string">
        <description>The allocated interface</description>
      </simple>
    </struct>
    <configurationkind kindtype="property"/>
  </structsequence>
</properties>
