<?xml version="1.0" encoding="UTF-8"?>
<!--
This file is protected by Copyright. Please refer to the COPYRIGHT file
distributed with this source distribution.

This file is part of REDHAWK core.

REDHAWK core is free software: you can redistribute it and/or modify it under
the terms of the GNU Lesser General Public License as published by the Free
Software Foundation, either version 3 of the License, or (at your option) any
later version.

REDHAWK core is distributed in the hope that it will be useful, but WITHOUT ANY
WARRANTY; without even the implied warranty of MERCHANTABILITY or FITNESS FOR
A PARTICULAR PURPOSE.  See the GNU Lesser General Public License for more
details.

You should have received a copy of the GNU Lesser General Public License along
with this program.  If not, see http://www.gnu.org/licenses/.
-->
<!DOCTYPE properties PUBLIC "-//JTRS//DTD SCA V2.2.2 PRF//EN" "properties.dtd">
<properties>
  <simple id="DCE:cdc5ee18-7ceb-4ae6-bf4c-31f983179b4d" mode="readonly" name="device_kind" type="string">
    <description>This specifies the device kind</description>
    <value>TestDevice</value>
    <kind kindtype="configure"/>
    <kind kindtype="allocation"/>
    <action type="eq"/>
  </simple>
  <simple id="DCE:0f99b2e4-9903-4631-9846-ff349d18ecfb" mode="readonly" name="device_model" type="string">
    <description> This specifies the specific device</description>
    <value>CppTestDevice</value>
    <kind kindtype="configure"/>
    <kind kindtype="allocation"/>
    <action type="eq"/>
  </simple>
  <simple id="disk_space" mode="readonly" name="disk_space" type="longlong">
    <value>100000000000</value>
    <units>bytes</units>
    <kind kindtype="configure"/>
    <kind kindtype="allocation"/>
    <action type="external"/>
  </simple>
  <simple id="load_average" mode="readonly" name="load_average" type="float">
    <value>0.0</value>
    <kind kindtype="configure"/>
    <kind kindtype="allocation"/>
    <action type="external"/>
  </simple>
  <simple id="memory_capacity" mode="readonly" name="memory_capacity" type="longlong">
    <value>2147483648</value>
    <units>bytes</units>
    <kind kindtype="configure"/>
    <action type="external"/>
  </simple>
  <simple id="shared_memory" mode="readonly" name="shared_memory" type="long">
    <value>33554432</value>
    <units>bytes</units>
    <kind kindtype="configure"/>
    <action type="external"/>
  </simple>
  <struct id="memory_allocation" mode="readwrite" name="memory_allocation">
    <simple id="capacity" name="capacity" type="long">
      <units>bytes</units>
    </simple>
    <simple id="contiguous" name="contiguous" type="boolean">
      <value>true</value>
    </simple>
    <simple id="memory_type" name="memory_type" type="long">
      <value>0</value>
      <enumerations>
        <enumeration label="PRIVATE" value="0"/>
        <enumeration label="SHARED" value="1"/>
      </enumerations>
    </simple>
    <configurationkind kindtype="allocation"/>
  </struct>
</properties>
