<?xml version="1.0" encoding="UTF-8"?>
<!DOCTYPE properties PUBLIC "-//JTRS//DTD SCA V2.2.2 PRF//EN" "properties.dtd">
<properties>
  <simple id="DCE:cdc5ee18-7ceb-4ae6-bf4c-31f983179b4d" mode="readonly" name="device_kind" type="string">
    <description>This specifies the device kind</description>
    <kind kindtype="allocation"/>
    <action type="eq"/>
  </simple>
  <simple id="DCE:0f99b2e4-9903-4631-9846-ff349d18ecfb" mode="readonly" name="device_model" type="string">
    <description> This specifies the specific device</description>
    <kind kindtype="allocation"/>
    <action type="eq"/>
  </simple>
  <simple id="testprop" mode="readwrite" type="string">
    <kind kindtype="property"/>
    <action type="external"/>
  </simple>
</properties>
