<?xml version="1.0" encoding="UTF-8"?>
<!--
This file is protected by Copyright. Please refer to the COPYRIGHT file
distributed with this source distribution.

This file is part of REDHAWK core.

REDHAWK core is free software: you can redistribute it and/or modify it under
the terms of the GNU Lesser General Public License as published by the Free
Software Foundation, either version 3 of the License, or (at your option) any
later version.

REDHAWK core is distributed in the hope that it will be useful, but WITHOUT ANY
WARRANTY; without even the implied warranty of MERCHANTABILITY or FITNESS FOR
A PARTICULAR PURPOSE.  See the GNU Lesser General Public License for more
details.

You should have received a copy of the GNU Lesser General Public License along
with this program.  If not, see http://www.gnu.org/licenses/.
-->
<!DOCTYPE properties PUBLIC "-//JTRS//DTD SCA V2.2.2 PRF//EN" "properties.dtd">
<properties>
  <simple id="complexBooleanProp" mode="readwrite" type="boolean" complex="true">
    <value>0+j1</value>
    <kind kindtype="property"/>
    <action type="external"/>
  </simple>
  <simple id="complexULongProp" mode="readwrite" type="ulong" complex="true">
    <value>4+j5</value>
    <kind kindtype="property"/>
    <action type="external"/>
  </simple>
  <simple id="complexShortProp" mode="readwrite" type="short" complex="true">
    <value>4+j5</value>
    <kind kindtype="property"/>
    <action type="external"/>
  </simple>
  <simple id="complexFloatProp" mode="readwrite" type="float" complex="true">
    <value>4+j5</value>
    <kind kindtype="property"/>
    <action type="external"/>
  </simple>
  <simple id="complexOctetProp" mode="readwrite" type="octet" complex="true">
    <value>4+j5</value>
    <kind kindtype="property"/>
    <action type="external"/>
  </simple>
  <simple id="complexUShort" mode="readwrite" type="ushort" complex="true">
    <value>4+j5</value>
    <kind kindtype="property"/>
    <action type="external"/>
  </simple>
  <simple id="complexDouble" mode="readwrite" type="double" complex="true">
    <value>4+j5</value>
    <kind kindtype="property"/>
    <action type="external"/>
  </simple>
  <simple id="complexLong" mode="readwrite" type="long" complex="true">
    <value>4+j5</value>
    <kind kindtype="property"/>
    <action type="external"/>
  </simple>
  <simple id="complexLongLong" mode="readwrite" type="longlong" complex="true">
    <value>4+j5</value>
    <kind kindtype="property"/>
    <action type="external"/>
  </simple>
  <simple id="complexULongLong" mode="readwrite" type="ulonglong" complex="true">
    <value>4+j5</value>
    <kind kindtype="property"/>
    <action type="external"/>
  </simple>

  <simplesequence id="complexFloatSequence" mode="readwrite" type="float" complex="true">
    <values>
      <value>6+j7</value>
      <value>4+j5</value>
      <value>8+j9</value>
    </values>
    <kind kindtype="property"/>
    <action type="external"/>
  </simplesequence>
  <struct id="FloatStruct" mode="readwrite">
    <simple id="FloatStructMember" mode="readwrite" type="float">
      <value>6</value>
      <kind kindtype="property"/>
      <action type="external"/>
    </simple>
    <configurationkind kindtype="property"/>
  </struct>
 
  <struct id="complexFloatStruct" mode="readwrite">
    <simple id="complexFloatStructMember" mode="readwrite" type="float" complex="true">
      <value>6+j7</value>
      <kind kindtype="property"/>
      <action type="external"/>
    </simple>
    <simplesequence id="complexFloatStruct::complex_float_seq" name="complex_float_seq" type="float" complex="true">
      <values>
        <value>3+j4</value>
      </values>
    </simplesequence>
    <configurationkind kindtype="property"/>
  </struct>
  <structsequence id="FloatStructSequence" mode="readwrite">
    <struct id="FloatStructSequenceMember">
      <simple id="FloatStructSequenceMemberMemember" type="float">
        <value>6</value>
      </simple>
      <simplesequence id="FloatStructSequence::float_seq" name="float_seq" type="float">
        <values>
          <value>3</value>
        </values>
      </simplesequence>
    </struct>
    <configurationkind kindtype="property"/>
  </structsequence>
  <structsequence id="complexFloatStructSequence" mode="readwrite">
    <struct id="complexFloatStructSequenceMember">
      <simple id="complexFloatStructSequenceMemberMemember" type="float" complex="true"/>
      <simplesequence id="complexFloatStructSequence::complex_float_seq" name="complex_float_seq" type="float" complex="true"/>
    </struct>
    <structvalue>
      <simpleref refid="complexFloatStructSequenceMemberMemember" value="9+j4"/>
      <simplesequenceref refid="complexFloatStructSequence::complex_float_seq">
        <values>
          <value>6+j5</value>
        </values>
      </simplesequenceref>
    </structvalue>
    <configurationkind kindtype="property"/>
  </structsequence>
</properties>
