<?xml version="1.0" encoding="UTF-8"?>
<!--
This file is protected by Copyright. Please refer to the COPYRIGHT file
distributed with this source distribution.

This file is part of REDHAWK codegenTesting.

REDHAWK codegenTesting is free software: you can redistribute it and/or modify it under
the terms of the GNU Lesser General Public License as published by the Free
Software Foundation, either version 3 of the License, or (at your option) any
later version.

REDHAWK codegenTesting is distributed in the hope that it will be useful, but WITHOUT ANY
WARRANTY; without even the implied warranty of MERCHANTABILITY or FITNESS FOR
A PARTICULAR PURPOSE.  See the GNU Lesser General Public License for more
details.

You should have received a copy of the GNU Lesser General Public License along
with this program.  If not, see http://www.gnu.org/licenses/.
-->
<!DOCTYPE properties PUBLIC "-//JTRS//DTD SCA V2.2.2 PRF//EN" "properties.dtd">
<properties>
  <simple id="floatenum" mode="readwrite" type="float">
    <value>0.0</value>
    <enumerations>
      <enumeration label="DEFAULT" value="0.0"/>
      <enumeration label="OTHER" value="1.0"/>
    </enumerations>
    <kind kindtype="property"/>
    <action type="external"/>
  </simple>
  <simple id="stringenum" mode="readwrite" type="string">
    <value>start</value>
    <enumerations>
      <enumeration label="START" value="start"/>
      <enumeration label="STOPPED" value="stopped"/>
    </enumerations>
    <kind kindtype="property"/>
    <action type="external"/>
  </simple>
  <struct id="structprop" mode="readwrite">
    <simple id="structprop::number" name="number" type="long">
      <enumerations>
        <enumeration label="ZERO" value="0"/>
        <enumeration label="ONE" value="1"/>
        <enumeration label="TWO" value="2"/>
      </enumerations>
    </simple>
    <simple id="structprop::alpha" name="alpha" type="string">
      <enumerations>
        <enumeration label="ABC" value="abc"/>
        <enumeration label="DEF" value="def"/>
      </enumerations>
    </simple>
    <configurationkind kindtype="property"/>
  </struct>
  <structsequence id="structseq" mode="readwrite">
    <struct id="structseq_struct">
      <simple id="structseq::number" name="number" type="long">
        <value>0</value>
        <enumerations>
          <enumeration label="POSITIVE" value="1"/>
          <enumeration label="ZERO" value="0"/>
          <enumeration label="NEGATIVE" value="-1"/>
        </enumerations>
      </simple>
      <simple id="structseq::text" name="text" type="string">
        <value>body</value>
        <enumerations>
          <enumeration label="HEADER" value="header"/>
          <enumeration label="BODY" value="body"/>
          <enumeration label="FOOTER" value="footer"/>
        </enumerations>
      </simple>
    </struct>
    <configurationkind kindtype="property"/>
  </structsequence>
</properties>